{
  "title": "قبول نظام مستندات TKA",
  "description": "عينة عربية للتحقق من الهوية، اتجاه الكتابة، سلامة المحتوى، والتصدير إلى الصيغ المطلوبة.",
  "language": "ar",
  "direction": "rtl",
  "profile": "tka-default",
  "sections": [
    {
      "heading": "الهدف ومعايير القبول",
      "paragraphs": [
        "يوحّد هذا النظام مخرجات المستندات مع هوية TKA Egypt دون إنشاء لوحة ألوان مستقلة.",
        "يتحقق الاختبار من العربية RTL ومن النص المختلط مثل API وPanda CSS وTKA-2026، مع الحفاظ على الترتيب والمعنى.",
        "هذا اختبار واقعي متعدد الصفحات. يجب ألا تُحذف الفقرات الطويلة أو تتجاوز حدود الصفحة عند التصدير. يجب ألا تُحذف الفقرات الطويلة أو تتجاوز حدود الصفحة عند التصدير. يجب ألا تُحذف الفقرات الطويلة أو تتجاوز حدود الصفحة عند التصدير. يجب ألا تُحذف الفقرات الطويلة أو تتجاوز حدود الصفحة عند التصدير. يجب ألا تُحذف الفقرات الطويلة أو تتجاوز حدود الصفحة عند التصدير. يجب ألا تُحذف الفقرات الطويلة أو تتجاوز حدود الصفحة عند التصدير. يجب ألا تُحذف الفقرات الطويلة أو تتجاوز حدود الصفحة عند التصدير. يجب ألا تُحذف الفقرات الطويلة أو تتجاوز حدود الصفحة عند التصدير. "
      ],
      "bullets": [
        "الأزرق الملكي للإجراءات والعناوين: #0846ED مصدره الوحيد panda.config.ts.",
        "الأصفر لون إبراز، والنص فوقه داكن لضمان المقروئية.",
        "يظل النص البرمجي باتجاه LTR داخل مستند RTL."
      ],
      "code": "const brand = { primary: \"brand.500\", accent: \"accent.500\" };\nconsole.log(\"TKA Egypt\");",
      "table": {
        "headers": [
          "البوابة",
          "الدليل",
          "الحالة"
        ],
        "rows": [
          [
            "المعمارية",
            "مصدر رموز موحد",
            "قيد الاختبار"
          ],
          [
            "المخرجات الخمس",
            "ملف فعلي وفحص بنية",
            "قيد الاختبار"
          ],
          [
            "اتجاه الكتابة",
            "RTL وLTR",
            "قيد الاختبار"
          ]
        ]
      }
    },
    {
      "heading": "الهوية والإخراج",
      "paragraphs": [
        "تحافظ المخرجات على ترتيب العناوين والفقرات والجداول، وتستخدم خط Readex Pro عند توفره مع بدائل نظامية.",
        "تُعامل مدخلات HTML كنص غير موثوق، ويجب تهريبها قبل وضعها في المستند."
      ]
    }
  ]
}
